{
  "corpus_definition_bundle_schema_version": "1.0.0",
  "definition_id": "fixture.generic-ct",
  "definition_version": "1.0.0",
  "profiles": [
    {
      "profile_id": "smoke",
      "scope": "valid",
      "members": []
    },
    {
      "profile_id": "core",
      "scope": "valid",
      "members": [
        "caller/arbitrary/signed-ct"
      ]
    },
    {
      "profile_id": "extended",
      "scope": "valid",
      "members": []
    },
    {
      "profile_id": "legacy",
      "scope": "legacy",
      "members": []
    },
    {
      "profile_id": "stress",
      "scope": "stress",
      "members": []
    },
    {
      "profile_id": "negative",
      "scope": "expected_invalid",
      "members": []
    },
    {
      "profile_id": "fuzz",
      "scope": "fuzz",
      "members": []
    },
    {
      "profile_id": "all",
      "scope": "valid",
      "union_of": [
        "smoke",
        "core",
        "extended"
      ],
      "optional_profile": "stress"
    }
  ],
  "registry": {
    "path": "cases/registry.json",
    "size_bytes": 991,
    "sha256": "efb0c68ba6fa5c9b8b417e23b24934e031ef3cb8e503af356b2fff2bb3c69359"
  },
  "cases": [
    {
      "case_id": "caller/arbitrary/signed-ct",
      "recipe_id": "caller_signed_ct",
      "recipe_version": "1.0.0",
      "recipe": {
        "path": "cases/recipes/caller-signed-ct.json",
        "size_bytes": 3900,
        "sha256": "63b3b00b0577d7e0b227e11250471d6763e25ca596b766e51c0e0690c43051db"
      },
      "dependencies": [],
      "evidence_ids": [],
      "asset_ids": []
    }
  ],
  "evidence": [],
  "assets": []
}
